{
 "_tipo": "semana_especial",
 "id": "REVIEW-DE-B2-2027-S46",
 "semana": 46,
 "idioma": "de",
 "nivel": "B2",
 "clase": "review",
 "titulo": "Skill Review Week",
 "minutosEstimados": 50,
 "consigna": "Drei getrennte Aufnahmen, eine pro Tag, je zwei bis drei Minuten. Jede isoliert zwei Fähigkeiten der Wochen 38 bis 45. Stichworte erlaubt, Text nicht.",
 "requisitos": [
  "Aufnahme 1: Vorschläge machen und aushandeln (Woche 38) + Kollokationen statt *machen* (Woche 40)",
  "Aufnahme 2: mündlich zusammenfassen (Woche 43) + Negation und Fokuspartikeln richtig setzen (Woche 44)",
  "Aufnahme 3: Funktionsverbgefüge dosiert einsetzen (Woche 42) + zwischen Nominal- und Verbalstil wechseln (Woche 45)",
  "Keine Aufnahme länger als drei Minuten",
  "In einer Aufnahme zwei selbst gebildete Komposita (Woche 39)"
 ],
 "microtareas": [
  "*Mo (10 Min.).* Aufnahme 1: Handle mündlich eine Lösung für ein Problem im Haus aus.",
  "*Mi (10 Min.).* Aufnahme 2: Fass einen Bericht zusammen und setz *nur* und *sogar* bewusst.",
  "*Fr (10 Min.).* Aufnahme 3: Sag denselben Inhalt einmal wie in einem Bericht und einmal wie am Telefon."
 ],
 "autochequeo": [
  "Sind alle sechs Fähigkeiten vorgekommen?",
  "Habe ich *machen* dort vermieden, wo ein anderes Verb hingehört?",
  "Stand die Negation an der richtigen Stelle?",
  "Waren die Funktionsverbgefüge dosiert oder aufgeblasen?",
  "Welche Fähigkeit hat sich über das Jahr am wenigsten verbessert?"
 ],
 "promptCorreccion": "Das sind drei getrennte kurze Produktionen mit je zwei Fähigkeiten. (1) Sag für jede, ob beide vorhanden und gelungen sind. (2) Nenne die Fähigkeit, die sich im Jahresvergleich am wenigsten verbessert hat. (3) Gib mir einen Satz, der eine Kollokation und ein Funktionsverbgefüge richtig kombiniert. Korrigiere nichts anderes. ---"
}
