{
 "_tipo": "semana_especial",
 "id": "REVIEW-DE-B2-S34",
 "semana": 34,
 "idioma": "de",
 "nivel": "B2",
 "clase": "review",
 "titulo": "Skill Review Week",
 "minutosEstimados": 50,
 "consigna": "Drei getrennte Aufnahmen, eine pro Tag, je zwei bis drei Minuten. Jede isoliert zwei Fähigkeiten der Wochen 26 bis 33. Notieren vorher ja, ablesen nein.",
 "requisitos": [
  "Aufnahme 1: eine Geschichte mit Plusquamperfekt erzählen (Woche 26) + Vermutungen ausdrücken (Woche 29)",
  "Aufnahme 2: indirekte Rede mit Konjunktiv I (Woche 27) + argumentieren mit Gewichtung (Woche 33)",
  "Aufnahme 3: relativieren und abschwächen (Woche 31) + bewusster Registerwechsel (Woche 32)",
  "Keine Aufnahme länger als drei Minuten",
  "In Aufnahme 2 mindestens einmal einwerfen oder nachfragen (Woche 28), falls mit einer anderen Person"
 ],
 "microtareas": [
  "*Mo (10 Min.).* Aufnahme 1: Erzählen Sie, was schon passiert war, bevor Sie eingegriffen haben — und vermuten Sie, warum.",
  "*Mi (10 Min.).* Aufnahme 2: Geben Sie wieder, was jemand behauptet hat, und argumentieren Sie dagegen.",
  "*Fr (10 Min.).* Aufnahme 3: Sagen Sie dieselbe vorsichtige Einschätzung zuerst umgangssprachlich, dann im Standard."
 ],
 "autochequeo": [
  "Sind alle sechs Fähigkeiten vorgekommen?",
  "Hat das Plusquamperfekt die Reihenfolge klar gemacht?",
  "Blieb der Konjunktiv I über mehrere Sätze durch?",
  "War die Abschwächung noch konkret genug?",
  "Gab es einen unbeabsichtigten Registerbruch?"
 ],
 "promptCorreccion": "Das sind drei getrennte kurze Produktionen mit je zwei Fähigkeiten. (1) Sag für jede, ob beide vorhanden und gelungen sind. (2) Sag mir, welche unter dem Druck des Sprechens zusammenbrach. (3) Gib mir einen Satz, der indirekte Rede und Abschwächung zusammen trägt. Korrigiere nichts anderes. ---"
}
