{
 "_tipo": "semana_especial",
 "id": "REVIEW-DE-B2-2027-S22",
 "semana": 22,
 "idioma": "de",
 "nivel": "B2",
 "clase": "review",
 "titulo": "Skill Review Week",
 "minutosEstimados": 50,
 "consigna": "Drei getrennte Aufnahmen, eine pro Tag, je zwei bis drei Minuten. Jede isoliert zwei Fähigkeiten der Wochen 14 bis 21. Stichworte vorher sind erlaubt, ein ausformulierter Text nicht.",
 "requisitos": [
  "Aufnahme 1: Konjunktiv II für Bitten und Bedauern (Woche 17) + subjektive Modalverben (Woche 16)",
  "Aufnahme 2: einen Text mündlich zusammenfassen, Kern zuerst (Woche 19) + Passiversatzformen (Woche 21)",
  "Aufnahme 3: Ratschläge geben (Woche 20) + reflexive Verben (Woche 18)",
  "Keine Aufnahme länger als drei Minuten",
  "In einer Aufnahme mindestens zwei Helvetismen aus Woche 14"
 ],
 "microtareas": [
  "*Mo (10 Min.).* Aufnahme 1: Beschwer dich mündlich über eine Lieferung, höflich im Konjunktiv II, und vermute, was passiert ist.",
  "*Mi (10 Min.).* Aufnahme 2: Fass eine Studie mündlich zusammen, ohne ständig *werden* zu benutzen.",
  "*Fr (10 Min.).* Aufnahme 3: Rate jemandem, der sich nicht abgrenzen kann."
 ],
 "autochequeo": [
  "Sind alle sechs Fähigkeiten vorgekommen?",
  "War der Konjunktiv II flüssig oder mühsam?",
  "Kam beim Zusammenfassen der Kern zuerst?",
  "Waren die reflexiven Verben richtig?",
  "Welche Aufnahme musste ich am häufigsten neu starten?"
 ],
 "promptCorreccion": "Das sind drei getrennte kurze Produktionen mit je zwei Fähigkeiten. (1) Sag für jede, ob beide vorhanden und gelungen sind. (2) Sag mir, welche Fähigkeit über alle drei hinweg am schwächsten war. (3) Gib mir einen Satz, der Konjunktiv II und Passiversatz zusammen trägt. Korrigiere nichts anderes. ---"
}
