{
 "_tipo": "semana_especial",
 "id": "REVIEW-DE-C1-2027-S46",
 "semana": 46,
 "idioma": "de",
 "nivel": "C1",
 "clase": "review",
 "titulo": "Skill Review Week",
 "minutosEstimados": 60,
 "consigna": "Eine einzige gesprochene Produktion von mindestens zehn Minuten: Verhandle mündlich über eine Sache, die dir wirklich wichtig ist — Wohnumfeld, Arbeitsbedingungen, ein Familienthema — und wechsle dabei bewusst zwischen zwei Registern, je nachdem, wen du ansprichst. Notizen vorher sind Vorbereitung, kein Skript.",
 "requisitos": [
  "Aushandeln mit bedingten Zugeständnissen (Woche 39)",
  "Derselbe Inhalt in zwei Registern (Woche 44)",
  "Zwei Infinitivsätze, die einen *dass*-Satz ersetzen (Woche 40)",
  "Zwei Genitivpräpositionen mit Nominalisierung (Woche 41)",
  "Vier Kollokationen, kein *machen* mit abstraktem Nomen (Woche 42)",
  "Zwei Funktionsverbgefüge, nicht mehr (Woche 43)"
 ],
 "microtareas": [
  "*Mo (10 Min.).* Alle Korrekturen des Jahres kurz durchgehen und die notieren, die von Woche 2 bis Woche 45 nie verschwunden ist.",
  "*Mi (5 Min.).* Drei Sätze bauen, die Infinitivsatz, Genitivpräposition und Kollokation zusammen tragen.",
  "*Fr (10 Min.).* Zehn Minuten aufnehmen. Danach prüfen: Ist die Jahreskorrektur wieder da?"
 ],
 "autochequeo": [
  "Sind alle sechs Fähigkeiten vorhanden?",
  "War der Registerwechsel gewollt oder ein Ausrutscher?",
  "Habe ich im Gesprochenen zu viel Nominalstil benutzt?",
  "Waren die Kollokationen richtig, auch unter Druck?",
  "Ist die Korrektur, die das ganze Jahr geblieben ist, noch da?"
 ],
 "promptCorreccion": "Das ist eine Wiederholung von sechs Fähigkeiten gleichzeitig: aushandeln, Registerwechsel, Infinitivsätze, Genitivpräpositionen, Kollokationen und Funktionsverbgefüge. (1) Sag zu jeder, ob sie vorhanden und gelungen ist. (2) Sag mir, welche sich über das Jahr am wenigsten gefestigt hat. (3) Gib mir einen Satz, der drei davon trägt. Korrigiere nichts ausserhalb dieser sechs Bereiche. ---"
}