{
 "_tipo": "semana_especial",
 "id": "REVIEW-DE-A2-S46",
 "semana": 46,
 "idioma": "de",
 "nivel": "A2",
 "clase": "review",
 "titulo": "Wiederholungswoche",
 "minutosEstimados": 30,
 "consigna": "Freitag, gesprochen: Erzählen Sie 90 Sekunden lang von einer Reise oder einem Umzug — was passiert ist und wie es Ihnen gefallen hat. Vorher zwei oder drei Ideen notieren, dann frei sprechen.",
 "requisitos": [
  "Eine Geschichte mit *zuerst* und *dann* (Woche 43)",
  "Zwei Adjektive mit richtiger Endung (Woche 44)",
  "Eine Meinung mit Grund (Woche 41)"
 ],
 "microtareas": [
  "*Mo (10 Min.).* Alle Korrekturen aus den Wochen 38 bis 45 durchsehen. Welcher Fehler ist über das ganze Jahr geblieben? Aufschreiben.",
  "*Mi (5 Min.).* Drei Sätze zu diesem Fehler schreiben — diesmal richtig.",
  "*Fr (5 Min.).* 90 Sekunden aufnehmen. Danach anhören: Ist der Fehler weg?"
 ],
 "autochequeo": [
  "Hatte die Geschichte eine klare Reihenfolge?",
  "Waren die Adjektivendungen richtig?",
  "Habe ich meine Meinung begründet?",
  "Ist der Fehler von Montag noch da?"
 ],
 "promptCorreccion": "Das ist eine Wiederholung von drei Dingen auf A2-Niveau: eine Geschichte erzählen, Adjektivendungen, Meinung mit Grund. (1) Sag zu jedem, ob es vorkommt und ob es richtig ist. (2) Nenne den Fehler, der sich hält. (3) Gib mir einen Satz mit allen drei Punkten. Korrigiere nichts anderes. ---"
}
