{
 "_tipo": "semana_especial",
 "id": "REVIEW-DE-B2-2026-S48",
 "semana": 48,
 "idioma": "de",
 "nivel": "B2",
 "clase": "review",
 "titulo": "Skill Review Week",
 "minutosEstimados": 50,
 "consigna": "Schreib einen Bericht von 300 Wörtern: eine Reise oder ein Projekt, das nicht wie geplant verlief — was passiert ist, was daraus folgt und was du anders gemacht hättest.",
 "requisitos": [
  "Mindestens zehn deklinierte Adjektive, alle drei Typen (Woche 41)",
  "Mindestens vier Konjunktiv-II-Formen, davon zwei Originalformen (Woche 42)",
  "Mindestens zwei subjektive Modalverben mit verschiedenem Sicherheitsgrad (Woche 43)",
  "Mindestens vier Präpositionalverben, davon zwei mit Korrelat (Woche 45)",
  "Mindestens zwei Passivformen, davon eine Ersatzform (Woche 46)",
  "Höchstens drei Redewendungen, je eine pro Absatz (Woche 47)"
 ],
 "microtareas": [
  "*Mo (10 Min.).* Die korrigierten Texte der Wochen 41–47 und die drei Zeilen aus der Survival Week noch einmal lesen. Den häufigsten Fehler notieren.",
  "*Mi (5 Min.).* Drei Sätze schreiben, die je drei der sechs Bereiche gleichzeitig enthalten.",
  "*Fr (5 Min.).* 90 Sekunden: Erzähl, was schiefgegangen ist, und was daraus folgt."
 ],
 "autochequeo": [
  "Sind alle sechs Bereiche vertreten, oder hat einer die anderen verdrängt?",
  "Haben die Adjektivendungen gehalten, als ich gleichzeitig auf das Passiv achten musste?",
  "Sind die Korrelate verschwunden, sobald ich über den Inhalt nachdenken musste?",
  "Habe ich den Fehler wiederholt, den ich am Montag notiert habe?",
  "Habe ich benutzt, was die Survival Week als Lücke gezeigt hat?"
 ],
 "promptCorreccion": "Das ist eine Wiederholung von sechs Bereichen gleichzeitig: Adjektivdeklination, Konjunktiv II, subjektive Modalverben, Präpositionalverben mit Korrelat, Passiv und Redewendungen. (1) Sag mir für jeden, ob er vorhanden und ob er gut umgesetzt ist. (2) Sag, welcher unter der Mehrfachbelastung zusammengebrochen ist. (3) Gib mir einen Satz, der drei davon gleichzeitig richtig trägt. Korrigier nichts ausserhalb dieser sechs Bereiche. ---"
}